{
  "finding_group_id": "OBJ-TYUMENSKAYA-5-GOLD-SEED-G-IOS4-078-CFG-01",
  "object_id": "OBJ-TYUMENSKAYA-5-GOLD-SEED",
  "run_id": "m1-tyumen-e2e",
  "matrix_scope": "MATRIX",
  "parameter_code": "IOS4-078",
  "parameter_id": 78,
  "parameter_mapping_status": "PROVISIONAL_DOMAIN_MAPPING",
  "title": "Изменена конфигурация вентиляции относительно ПД",
  "element_noun": "Вентиляция",
  "axis": "PD_RD",
  "comparison_result": "CONFIGURATION_MISMATCH",
  "discrepancy_type": "CONFIGURATION_CHANGED",
  "location_type": "ROOM",
  "locations": [
    "147",
    "198",
    "314"
  ],
  "pd_value": "Конфигурация вентиляции по листу 10 ПД",
  "rd_value": "Конфигурация вентиляции изменена",
  "id_value": null,
  "violation_label": "VIOLATION_PRESENT",
  "protocol_status": "CRITICAL",
  "criticality": "Критическое (приостановка работ)",
  "criticality_level": "CRITICAL_SUSPEND",
  "anchor_evidence": [
    {
      "stage": "PD",
      "file_id": "F0171",
      "pdf_page_number": 88,
      "is_anchor": true,
      "document_sheet_number": 10
    },
    {
      "stage": "RD",
      "file_id": "F0201",
      "pdf_page_number": 18,
      "is_anchor": true,
      "document_sheet_number": 4
    }
  ],
  "location_pages": {
    "314": [
      {
        "stage": "RD",
        "file_id": "F0201",
        "pdf_page_number": 20,
        "is_anchor": false,
        "document_sheet_number": 7
      }
    ]
  },
  "finding_ids": [
    "OBJ-TYUMENSKAYA-5-GOLD-SEED-IOS4-078-PDRD-147",
    "OBJ-TYUMENSKAYA-5-GOLD-SEED-IOS4-078-PDRD-198",
    "OBJ-TYUMENSKAYA-5-GOLD-SEED-IOS4-078-PDRD-314"
  ],
  "card_no": "Б.4"
}
